{
    "$schema": "https://json-schema.org/draft/2020-12/schema",
    "type": "array",
    "items": {
        "type": "object",
        "required": [
            "name",
            "taxon_id",
            "min_count",
            "required_refs",
            "min_coverage",
            "additional_refs"
        ],
        "properties": {
            "name": {
                "type": "string",
                "minLength": 1
            },
            "taxon_id": {
                "type": "integer",
                "minimum": 1
            },
            "alt_taxon_id": {
                "type": "array",
                "items": {
                    "type": "integer",
                    "minimum": 1
                },
                "minItems": 1,
                "uniqueItems": true
            },
            "min_count": {
                "type": "integer",
                "minimum": 0
            },
            "required_refs": {
                "type": "array",
                "items": {
                    "type": "string",
                    "pattern": "^[A-Z]{1,3}_?[0-9]+\\.[1-9]$"
                },
                "minItems": 1,
                "uniqueItems": true
            },
            "min_coverage": {
                "type": "number",
                "minimum": 0,
                "maximum": 1
            },
            "additional_refs": {
                "type": "array",
                "items": {
                    "type": "string",
                    "pattern": "^[A-Z]{1,3}_?[0-9]+\\.[1-9]$"
                },
                "uniqueItems": true
            }
        },
        "additionalProperties": false,
        "allOf": [
            {
                "if": {
                    "required": [
                        "alt_taxon_id"
                    ]
                },
                "then": {
                    "properties": {
                        "alt_taxon_id": {
                            "minItems": 1
                        }
                    }
                }
            }
        ]
    }
}